<?xml version="1.0" encoding="UTF-8"?>
<p:frigdeManagerStorage xmlns:p="http://meinnamespace.meinefirma.de" xmlns:xsi="http://www.w3.org/2001/XMLSchema-instance" xsi:schemaLocation="http://meinnamespace.meinefirma.de fridgemanagerstorage.xsd ">
  <p:profiles>
    <p:profile>
      <p:name>Bernd</p:name>
      <p:birthdate>2001-01-01</p:birthdate>
      <p:gender>m</p:gender>
      <p:height>180</p:height>
      <p:weight>70</p:weight>
    </p:profile>
    <p:profile>
      <p:name>Tanja</p:name>
      <p:birthdate>2001-01-01</p:birthdate>
      <p:gender>w</p:gender>
      <p:height>160</p:height>
      <p:weight>60</p:weight>
    </p:profile>
    <p:profile>
      <p:name>Berthold</p:name>
      <p:birthdate>2001-01-01</p:birthdate>
      <p:gender>m</p:gender>
      <p:height>170</p:height>
      <p:weight>90</p:weight>
    </p:profile>
  </p:profiles>
</p:frigdeManagerStorage>
